{
  "evidence_id": "ev_ui_action_integration_responsive_07e7e65",
  "revision": "07e7e65",
  "valid_through_revision": "07e7e65",
  "gate_id": "gate_ui_responsive",
  "claim": "All decisive map targets and primary actions fit and remain operable at 844x390 and 568x320.",
  "scenario_id": "scenario_ui_path_integration",
  "execution_id": "ui_action_integration_07e7e65",
  "evidence_type": "capture",
  "artifact_or_command": "project-a/artifacts/scenario-mobile-action-compass dual-size shipping screen captures",
  "case_results": [
    {
      "case_id": "cross_screen_cohesion",
      "result": "pass",
      "assertions": [
        "action target and primary CTA fit both target viewports",
        "tabs and reward rail stay inside content region"
      ],
      "artifacts": [
        "project-a/artifacts/scenario-mobile-action-compass/active_hurdle-844x390.png",
        "project-a/artifacts/scenario-mobile-action-compass/active_hurdle-568x320.png"
      ]
    }
  ],
  "artifact_manifest": [
    "UI smoke assertions",
    "canonical captures",
    "exit code"
  ],
  "environment": {
    "engine": "Godot 4.6.3",
    "platform": "macOS Compatibility",
    "device": "Apple M4",
    "viewport": "844x390 and 568x320",
    "seed": 20260731,
    "build_mode": "debug"
  },
  "grader": {
    "kind": "runtime",
    "name": "dual-size shipping GoalsScreen audit",
    "version": "1",
    "independence": "not_applicable"
  },
  "observation": "Both target sizes retain tabs, current objective, reward state and one primary action without clipping.",
  "inference": "Affected shared responsive gate passes.",
  "result": "pass",
  "confidence": 0.96,
  "freshness": "current",
  "limitations": [
    "Focused shipping screen capture does not emulate dynamic browser chrome."
  ],
  "schema_version": "caesar-loop/v2",
  "run_id": "ui_ux_gauntlet_20260731"
}
