{
  "evidence_id": "ev_doctrine_runtime_c48c224",
  "revision": "c48c224",
  "valid_through_revision": "3b797a9",
  "gate_id": "gate_doctrine_deck_runtime",
  "claim": "Doctrine actions preserve exact coordination and specialization identities while activated state exposes no replacement action.",
  "scenario_id": "scenario_mobile_faction_doctrine_command_deck",
  "execution_id": "doctrine_runtime_c48c224",
  "evidence_type": "test",
  "artifact_or_command": "godot --headless --path project-a --script res://tools/run_blueprint_screen_tests.gd && godot --path project-a --script res://tools/capture_faction_doctrine_deck_scenario.gd",
  "case_results": [
    {
      "case_id": "assault_choice",
      "result": "pass",
      "assertions": [
        "both buttons emit exact coordination and specialization ids"
      ],
      "artifacts": [
        "project-a/artifacts/scenario-mobile-faction-doctrine-deck/assault_choice-844x390.png"
      ]
    },
    {
      "case_id": "armored_choice",
      "result": "pass",
      "assertions": [
        "both buttons retain exact doctrine ids for armored faction"
      ],
      "artifacts": [
        "project-a/artifacts/scenario-mobile-faction-doctrine-deck/armored_choice-844x390.png"
      ]
    },
    {
      "case_id": "doctrine_activated",
      "result": "pass",
      "assertions": [
        "activated state hides both replacement actions"
      ],
      "artifacts": [
        "project-a/artifacts/scenario-mobile-faction-doctrine-deck/doctrine_activated-844x390.png"
      ]
    }
  ],
  "artifact_manifest": [
    "runtime assertions",
    "assault captures",
    "armored captures",
    "activated captures",
    "case manifest",
    "exit code"
  ],
  "environment": {
    "engine": "Godot 4.6.3",
    "platform": "macOS Compatibility",
    "device": "Apple M4",
    "viewport": "844x390 and 568x320",
    "seed": 20260731,
    "build_mode": "debug"
  },
  "grader": {
    "kind": "runtime",
    "name": "BlueprintScreen doctrine identity assertions",
    "version": "1",
    "independence": "not_applicable"
  },
  "observation": "BLUEPRINT_SCREEN_TESTS_OK and FACTION_DOCTRINE_DECK_SCENARIO_OK; exact action payloads pass and activated state exposes no doctrine action.",
  "inference": "The visual command deck preserves durable doctrine semantics.",
  "result": "pass",
  "confidence": 0.99,
  "freshness": "current",
  "limitations": [
    "No target-player comprehension claim."
  ],
  "schema_version": "caesar-loop/v2",
  "run_id": "ui_ux_gauntlet_20260731"
}
