{
  "evidence_id": "ev_ui_growth_integration_runtime_7626daf",
  "revision": "7626daf",
  "valid_through_revision": "7626daf",
  "gate_id": "gate_ui_runtime",
  "claim": "Title, factory and war-zone actions use shipping state and navigation without regressions.",
  "scenario_id": "scenario_ui_path_integration",
  "execution_id": "ui_growth_integration_7626daf",
  "evidence_type": "test",
  "artifact_or_command": "cd project-a && godot --headless --path . -s tools/run_legion_screen_tests.gd && godot --headless --path . -s tools/run_first_growth_flow_tests.gd && godot --headless --path . -s tools/run_ui_smoke_tests.gd && godot --headless --path . -s tools/run_ui_focus_tests.gd",
  "case_results": [
    {
      "case_id": "cross_screen_cohesion",
      "result": "pass",
      "assertions": [
        "legion growth, boss handoff, global navigation and focus contracts pass after native-resolution config change"
      ],
      "artifacts": [
        "project-a/artifacts/scenario-mobile-first-growth-duel/manifest.json"
      ]
    }
  ],
  "artifact_manifest": [
    "UI smoke assertions",
    "canonical captures",
    "exit code"
  ],
  "environment": {
    "engine": "Godot 4.6.3",
    "platform": "macOS Compatibility",
    "device": "Apple M4",
    "viewport": "844x390 and 568x320",
    "seed": 20260731,
    "build_mode": "debug"
  },
  "grader": {
    "kind": "runtime",
    "name": "shared UI growth regression suite",
    "version": "1",
    "independence": "not_applicable"
  },
  "observation": "Legion, first-growth, UI smoke and focus suites pass at 7626daf.",
  "inference": "Native-resolution preview and growth duel integrate without shipping navigation regressions.",
  "result": "pass",
  "confidence": 0.97,
  "freshness": "stale",
  "limitations": [
    "Full browser journey not rerun."
  ],
  "schema_version": "caesar-loop/v2",
  "run_id": "ui_ux_gauntlet_20260731"
}
