{
  "evidence_id": "ev_ui_gauntlet_runtime_baseline_16b05bb",
  "run_id": "ui_ux_gauntlet_20260731",
  "revision": "16b05bb",
  "valid_through_revision": "16b05bb",
  "gate_id": "gate_ui_runtime",
  "claim": "Title, factory and war-zone actions use shipping state and navigation without regressions.",
  "scenario_id": "scenario_war_zone_exploration",
  "execution_id": "war_zone_baseline_16b05bb",
  "evidence_type": "test",
  "artifact_or_command": "godot --headless --path project-a -s tools/run_war_zone_screen_tests.gd",
  "case_results": [
    {
      "case_id": "territorial_progress",
      "result": "pass",
      "assertions": [
        "five stable nodes, disabled states, selection and CTA assertions pass"
      ],
      "artifacts": [
        "project-a/artifacts/scenario-war-zone-exploration/manifest.json"
      ]
    },
    {
      "case_id": "compact_frontier",
      "result": "pass",
      "assertions": [
        "compact targets and detail remain inside viewport"
      ],
      "artifacts": [
        "project-a/artifacts/scenario-war-zone-exploration/war-zone-568x320.png"
      ]
    }
  ],
  "artifact_manifest": [
    "runtime assertions",
    "844 capture",
    "568 capture",
    "case manifest",
    "exit code"
  ],
  "environment": {
    "engine": "Godot 4.6.3",
    "platform": "macOS Compatibility representative Web runtime",
    "viewport": "844x390 and 568x320",
    "seed": 20260731,
    "build_mode": "debug"
  },
  "grader": {
    "kind": "runtime",
    "name": "run_war_zone_screen_tests.gd",
    "version": "1",
    "independence": "not_applicable"
  },
  "observation": "Focused stage selection, stable IDs, disabled states, detail and CTA assertions pass in both layouts.",
  "inference": "The shipping war-zone interaction baseline is functional before the visual change.",
  "result": "pass",
  "confidence": 0.98,
  "freshness": "stale",
  "limitations": [
    "Does not judge atmosphere or player desire."
  ],
  "created_at": "2026-07-31T19:05:00+08:00",
  "schema_version": "caesar-loop/v2"
}
