{
  "schema_version": "caesar-loop/v2",
  "evidence_id": "ev_factory_baseline_responsive_c4fd219",
  "run_id": "ui_ux_gauntlet_20260731",
  "revision": "c4fd219",
  "valid_through_revision": "c4fd219",
  "gate_id": "gate_factory_responsive",
  "claim": "Factory world targets and contextual controls remain visible and touch-sized at 844x390 and 568x320.",
  "scenario_id": "scenario_factory_world_hud",
  "execution_id": "factory_hud_baseline_c4fd219",
  "evidence_type": "runtime_state",
  "artifact_or_command": "project-a/artifacts/scenario-factory-hud/manifest.json",
  "case_results": [
    {
      "case_id": "mission_world_first",
      "result": "pass",
      "assertions": [
        "touch controls fit"
      ],
      "artifacts": [
        "project-a/artifacts/scenario-factory-hud/mission_world_first-568x320.png"
      ]
    },
    {
      "case_id": "contextual_facility",
      "result": "fail",
      "assertions": [
        "compact panel leaves insufficient center world field"
      ],
      "artifacts": [
        "project-a/artifacts/scenario-factory-hud/contextual_facility-568x320.png"
      ]
    },
    {
      "case_id": "construction_carousel",
      "result": "fail",
      "assertions": [
        "large frame dominates compact viewport"
      ],
      "artifacts": [
        "project-a/artifacts/scenario-factory-hud/construction_carousel-568x320.png"
      ]
    },
    {
      "case_id": "placement_decision",
      "result": "fail",
      "assertions": [
        "central placement field is obscured"
      ],
      "artifacts": [
        "project-a/artifacts/scenario-factory-hud/placement_decision-568x320.png"
      ]
    }
  ],
  "artifact_manifest": [
    "runtime assertions",
    "mission captures",
    "facility captures",
    "build captures",
    "placement captures",
    "case manifest",
    "exit code"
  ],
  "environment": {
    "engine": "Godot 4.6.3",
    "platform": "macOS Compatibility",
    "device": "Apple M4",
    "viewport": "844x390 and 568x320",
    "seed": 20260731,
    "build_mode": "debug"
  },
  "grader": {
    "kind": "runtime",
    "name": "dual viewport geometry audit",
    "version": "1",
    "independence": "not_applicable"
  },
  "observation": "Controls remain touch-sized, but contextual frames obscure the compact world field in three of four cases.",
  "inference": "Responsive baseline fails the world-visibility portion of the gate.",
  "result": "fail",
  "confidence": 0.96,
  "freshness": "stale",
  "limitations": [
    "Neutral field does not reproduce final 3D camera targets."
  ],
  "created_at": "2026-07-31T19:00:00+08:00"
}
