{
  "schema_version": "caesar-loop/v2",
  "evidence_id": "ev_legion_baseline_runtime_2e23dd4",
  "run_id": "ui_ux_gauntlet_20260731",
  "revision": "2e23dd4",
  "valid_through_revision": "2e23dd4",
  "gate_id": "gate_legion_runtime",
  "claim": "Formation selection and deployment preserve shipping tab and action signals across empty, selected and full squad states.",
  "scenario_id": "scenario_legion_formation_identity",
  "execution_id": "legion_baseline_2e23dd4",
  "evidence_type": "runtime_state",
  "artifact_or_command": "run_legion_screen_tests.gd plus capture_legion_formation_scenario.gd twice",
  "case_results": [
    {
      "case_id": "single_commander",
      "result": "pass",
      "assertions": [
        "six shipping slots render and selection signals remain available"
      ],
      "artifacts": [
        "project-a/artifacts/scenario-legion-formation/baseline/single_commander-844x390.png"
      ]
    },
    {
      "case_id": "slot_selected",
      "result": "pass",
      "assertions": [
        "selected slot and candidate actions retain exact IDs"
      ],
      "artifacts": [
        "project-a/artifacts/scenario-legion-formation/baseline/slot_selected-844x390.png"
      ]
    },
    {
      "case_id": "full_squad",
      "result": "pass",
      "assertions": [
        "counterattack state preserves stage action"
      ],
      "artifacts": [
        "project-a/artifacts/scenario-legion-formation/baseline/full_squad-568x320.png"
      ]
    }
  ],
  "artifact_manifest": [
    "runtime assertions",
    "single commander captures",
    "selected slot captures",
    "full squad captures",
    "case manifest",
    "exit code"
  ],
  "environment": {
    "engine": "Godot 4.6.3",
    "platform": "macOS Compatibility",
    "device": "Apple M4",
    "viewport": "844x390 and 568x320",
    "seed": 20260731,
    "build_mode": "debug"
  },
  "grader": {
    "kind": "runtime",
    "name": "LegionScreen focused fixture",
    "version": "1",
    "independence": "not_applicable"
  },
  "observation": "Two scenario launches produced identical hashes and existing LegionScreen actions remain bound to shipping signals.",
  "inference": "Runtime baseline passes before the visual reconstruction.",
  "result": "pass",
  "confidence": 0.99,
  "freshness": "current",
  "limitations": [
    "Does not judge character identity."
  ],
  "created_at": "2026-07-31T20:35:00+08:00"
}
