{
  "evidence_id": "ev_blueprint_forge_runtime_4336f06",
  "revision": "4336f06",
  "valid_through_revision": "3b797a9",
  "gate_id": "gate_blueprint_forge_runtime",
  "claim": "Blueprint selection, start research and claim handoff preserve stable recipe identities and durable commands.",
  "scenario_id": "scenario_blueprint_character_forge",
  "execution_id": "blueprint_forge_candidate_4336f06",
  "evidence_type": "runtime_state",
  "artifact_or_command": "cd project-a && godot --headless --path . -s tools/run_blueprint_screen_tests.gd",
  "case_results": [
    {
      "case_id": "available_research",
      "result": "pass",
      "assertions": [
        "可研发状态仅暴露研发操作并显示角色主视觉"
      ],
      "artifacts": [
        "project-a/artifacts/scenario-blueprint-character-forge/available_research-844x390.png"
      ]
    },
    {
      "case_id": "ready_to_claim",
      "result": "pass",
      "assertions": [
        "可领取状态把主操作切换为领取角色"
      ],
      "artifacts": [
        "project-a/artifacts/scenario-blueprint-character-forge/ready_to_claim-844x390.png"
      ]
    },
    {
      "case_id": "locked_preview",
      "result": "pass",
      "assertions": [
        "锁定预览显示来源且不暴露虚假主操作"
      ],
      "artifacts": [
        "project-a/artifacts/scenario-blueprint-character-forge/locked_preview-844x390.png"
      ]
    }
  ],
  "artifact_manifest": [
    "runtime assertions",
    "available captures",
    "ready captures",
    "locked captures",
    "case manifest",
    "exit code"
  ],
  "environment": {
    "engine": "Godot 4.6.3",
    "platform": "macOS Compatibility",
    "device": "Apple M4",
    "viewport": "844x390 and 568x320",
    "seed": 20260731,
    "build_mode": "debug"
  },
  "grader": {
    "kind": "runtime",
    "name": "blueprint screen focused assertions",
    "version": "1",
    "independence": "not_applicable"
  },
  "observation": "BLUEPRINT_SCREEN_TESTS_OK；三态沿用 shipping view/action contract。",
  "inference": "蓝图研发交互在当前提交可重复执行。",
  "result": "pass",
  "confidence": 0.98,
  "freshness": "current",
  "limitations": [
    "未以真人触控设备验证拇指舒适度。"
  ],
  "schema_version": "caesar-loop/v2",
  "run_id": "ui_ux_gauntlet_20260731"
}
