{
  "schema_version": "caesar-loop/v2",
  "evidence_id": "ev_candidate_integration_runtime_b13a0a1",
  "run_id": "ui_ux_gauntlet_20260731",
  "revision": "b13a0a1",
  "valid_through_revision": "b13a0a1",
  "gate_id": "gate_ui_runtime",
  "claim": "Title, factory and war-zone actions use shipping state and navigation without regressions.",
  "scenario_id": "scenario_ui_path_integration",
  "execution_id": "ui_path_b13a0a1",
  "evidence_type": "runtime_state",
  "artifact_or_command": "godot --headless --path project-a -s tools/run_ui_smoke_tests.gd && godot --path project-a -s tools/capture_ui_review.gd",
  "case_results": [
    {
      "case_id": "cross_screen_cohesion",
      "result": "pass",
      "assertions": [
        "UI SMOKE TESTS PASS",
        "UI REVIEW CAPTURE PASS",
        "Godot import completed without script errors"
      ],
      "artifacts": [
        "project-a/artifacts/ui-review"
      ]
    }
  ],
  "artifact_manifest": [
    "UI smoke assertions",
    "canonical captures",
    "exit code"
  ],
  "environment": {
    "engine": "Godot 4.6.3",
    "platform": "macOS Compatibility",
    "device": "Apple M4",
    "viewport": "844x390 and 568x320",
    "seed": 20260731,
    "build_mode": "debug"
  },
  "grader": {
    "kind": "runtime",
    "name": "canonical UI integration",
    "version": "1",
    "independence": "not_applicable"
  },
  "observation": "Shipping UI smoke assertions and the one allowed canonical capture launch passed.",
  "inference": "The focused map improvement did not regress the shared title/factory/map route.",
  "result": "pass",
  "confidence": 0.98,
  "freshness": "current",
  "limitations": [
    "Capture process reports pre-existing resources in use at process exit after PASS."
  ],
  "created_at": "2026-07-31T18:05:00+08:00"
}
