{
  "evidence_id": "ev_breakthrough_visual_runtime_5a8d8a4",
  "revision": "5a8d8a4",
  "valid_through_revision": "b562758",
  "gate_id": "gate_breakthrough_reveal_visual",
  "claim": "Research breakthrough reads as two permanent toilet heroes joining the resistance rather than a ten-cell reward spreadsheet.",
  "scenario_id": "scenario_mobile_breakthrough_hero_reveal",
  "execution_id": "breakthrough_visual_runtime_5a8d8a4",
  "evidence_type": "capture",
  "artifact_or_command": "godot --path project-a --script res://tools/capture_breakthrough_hero_reveal_scenario.gd",
  "case_results": [
    {
      "case_id": "mixed_reveal",
      "result": "pass",
      "assertions": [
        "matched transparent hero art dominates above a compact icon loot strip"
      ],
      "artifacts": [
        "project-a/artifacts/scenario-mobile-breakthrough-hero-reveal/mixed_reveal-844x390.png",
        "project-a/artifacts/scenario-mobile-breakthrough-hero-reveal/mixed_reveal-568x320.png"
      ]
    },
    {
      "case_id": "resource_heavy_reveal",
      "result": "pass",
      "assertions": [
        "material variation stays subordinate to both permanent characters"
      ],
      "artifacts": [
        "project-a/artifacts/scenario-mobile-breakthrough-hero-reveal/resource_heavy_reveal-844x390.png",
        "project-a/artifacts/scenario-mobile-breakthrough-hero-reveal/resource_heavy_reveal-568x320.png"
      ]
    },
    {
      "case_id": "reduced_motion_reveal",
      "result": "pass",
      "assertions": [
        "final hero-led reward hierarchy appears immediately"
      ],
      "artifacts": [
        "project-a/artifacts/scenario-mobile-breakthrough-hero-reveal/reduced_motion_reveal-844x390.png",
        "project-a/artifacts/scenario-mobile-breakthrough-hero-reveal/reduced_motion_reveal-568x320.png"
      ]
    }
  ],
  "artifact_manifest": [
    "runtime assertions",
    "mixed reveal captures",
    "resource-heavy captures",
    "reduced-motion captures",
    "case manifest",
    "exit code"
  ],
  "environment": {
    "engine": "Godot 4.6.3",
    "platform": "macOS Compatibility",
    "device": "Apple M4",
    "viewport": "844x390 and 568x320",
    "seed": 20260731,
    "build_mode": "debug"
  },
  "grader": {
    "kind": "runtime",
    "name": "deterministic breakthrough hero-reveal capture audit",
    "version": "1",
    "independence": "not_applicable"
  },
  "observation": "Both hero portraits, roles and impacts dominate; all secondary rewards collapse into eight small icon chips and one legion handoff.",
  "inference": "Deterministic artifacts are ready for independent aesthetic review.",
  "result": "pass",
  "confidence": 0.98,
  "freshness": "current",
  "limitations": [
    "Runtime capture is not an independent aesthetic judgment."
  ],
  "schema_version": "caesar-loop/v2",
  "run_id": "ui_ux_gauntlet_20260731"
}
