{
  "evidence_id": "ev_boss_briefing_runtime_059157f",
  "revision": "059157f",
  "valid_through_revision": "874a992",
  "gate_id": "gate_boss_briefing_runtime",
  "claim": "Underpowered, ready and cleared boss states emit exact preparation, attack and replay actions for stage_1_5.",
  "scenario_id": "scenario_mobile_boss_siege_briefing",
  "execution_id": "boss_briefing_runtime_059157f",
  "evidence_type": "test",
  "artifact_or_command": "war-zone screen tests plus focused three-state scenario",
  "case_results": [
    {
      "case_id": "underpowered_boss",
      "result": "pass",
      "assertions": [
        "upgrade preparation and stage_1_5 probe exact"
      ],
      "artifacts": [
        "project-a/artifacts/scenario-mobile-boss-siege-briefing/underpowered_boss-844x390.png"
      ]
    },
    {
      "case_id": "boss_ready",
      "result": "pass",
      "assertions": [
        "stage_1_5 attack exact"
      ],
      "artifacts": [
        "project-a/artifacts/scenario-mobile-boss-siege-briefing/boss_ready-844x390.png"
      ]
    },
    {
      "case_id": "boss_cleared",
      "result": "pass",
      "assertions": [
        "stage_1_5 replay exact and cleared state retained"
      ],
      "artifacts": [
        "project-a/artifacts/scenario-mobile-boss-siege-briefing/boss_cleared-844x390.png"
      ]
    }
  ],
  "artifact_manifest": [
    "runtime assertions",
    "underpowered captures",
    "ready captures",
    "cleared captures",
    "case manifest",
    "exit code"
  ],
  "environment": {
    "engine": "Godot 4.6.3",
    "platform": "macOS Compatibility",
    "device": "Apple M4",
    "viewport": "844x390 and 568x320",
    "seed": 20260731,
    "build_mode": "debug"
  },
  "grader": {
    "kind": "runtime",
    "name": "boss briefing shipping signal assertions",
    "version": "1",
    "independence": "not_applicable"
  },
  "observation": "WAR_ZONE_SCREEN_TESTS_OK and BOSS_SIEGE_BRIEFING_SCENARIO_OK; all exact signals pass.",
  "inference": "The fortress landmark preserves all map actions and state identities.",
  "result": "pass",
  "confidence": 0.99,
  "freshness": "current",
  "limitations": [],
  "schema_version": "caesar-loop/v2",
  "run_id": "ui_ux_gauntlet_20260731"
}
