{
  "evidence_id": "ev_ui_pass_integration_runtime_b562758",
  "revision": "b562758",
  "valid_through_revision": "b562758",
  "gate_id": "gate_ui_runtime",
  "claim": "Title, factory and war-zone actions use shipping state and navigation without regressions.",
  "scenario_id": "scenario_ui_path_integration",
  "execution_id": "ui_pass_integration_runtime_b562758",
  "evidence_type": "test",
  "artifact_or_command": "godot --headless --path project-a -s tools/run_ui_smoke_tests.gd; goals and mobile-scroll focused suites",
  "case_results": [
    {
      "case_id": "cross_screen_cohesion",
      "result": "pass",
      "assertions": [
        "shipping navigation and shared UI contracts pass; pass actions remain exact"
      ],
      "artifacts": [
        "project-a/artifacts/ui-title-844x390.png",
        "project-a/artifacts/ui-battle-pass-runway-844x390.png"
      ]
    }
  ],
  "artifact_manifest": [
    "UI smoke assertions",
    "canonical captures",
    "exit code"
  ],
  "environment": {
    "engine": "Godot 4.6.3",
    "platform": "macOS Compatibility",
    "device": "Apple M4",
    "viewport": "844x390 and 568x320",
    "seed": 20260731,
    "build_mode": "debug"
  },
  "grader": {
    "kind": "runtime",
    "name": "shared mobile UI integration assertions",
    "version": "1",
    "independence": "not_applicable"
  },
  "observation": "UI_SMOKE_TESTS_PASS, GOALS_SCREEN_TESTS_OK and MOBILE_SCROLL_INPUT_TESTS_OK at the integrated revision.",
  "inference": "The accepted title, factory, map and goals contracts remain coherent after the shared input change.",
  "result": "pass",
  "confidence": 0.98,
  "freshness": "current",
  "limitations": [
    "Existing headless exit leak warnings remain non-failing."
  ],
  "schema_version": "caesar-loop/v2",
  "run_id": "ui_ux_gauntlet_20260731"
}
