{
  "schema_version": "caesar-loop/v2",
  "evidence_id": "ev_legion_visual_runtime_eacfb8b",
  "run_id": "ui_ux_gauntlet_20260731",
  "revision": "eacfb8b",
  "valid_through_revision": "07e7e65",
  "gate_id": "gate_legion_visual",
  "claim": "The formation screen reads as a six-character toilet resistance squad rather than a generic roster table.",
  "scenario_id": "scenario_legion_formation_identity",
  "execution_id": "legion_candidate_eacfb8b",
  "evidence_type": "visual_diff",
  "artifact_or_command": "baseline and candidate deterministic dual-size three-state bundles",
  "case_results": [
    {
      "case_id": "single_commander",
      "result": "pass",
      "assertions": [
        "Gman WebP portrait replaces SVG badge and broad text tabs become compact icon tools"
      ],
      "artifacts": [
        "project-a/artifacts/scenario-legion-formation/single_commander-844x390.png"
      ]
    },
    {
      "case_id": "slot_selected",
      "result": "pass",
      "assertions": [
        "assault and armored portraits lead contextual candidate cards"
      ],
      "artifacts": [
        "project-a/artifacts/scenario-legion-formation/slot_selected-844x390.png"
      ]
    },
    {
      "case_id": "full_squad",
      "result": "pass",
      "assertions": [
        "six distinct toilet-character portraits replace single-character initials"
      ],
      "artifacts": [
        "project-a/artifacts/scenario-legion-formation/full_squad-568x320.png"
      ]
    }
  ],
  "artifact_manifest": [
    "runtime assertions",
    "single commander captures",
    "selected slot captures",
    "full squad captures",
    "case manifest",
    "exit code"
  ],
  "environment": {
    "engine": "Godot 4.6.3",
    "platform": "macOS Compatibility",
    "device": "Apple M4",
    "viewport": "844x390 and 568x320",
    "seed": 20260731,
    "build_mode": "debug"
  },
  "grader": {
    "kind": "diff",
    "name": "deterministic formation before-after bundle",
    "version": "1",
    "independence": "not_applicable"
  },
  "observation": "Existing 8-12KB WebP character art now carries slot and candidate identity while text is reduced to role and action labels.",
  "inference": "Deterministic visual evidence supports the mixed gate pending independent critique.",
  "result": "pass",
  "confidence": 0.96,
  "freshness": "current",
  "limitations": [
    "Diff evidence cannot close a mixed gate alone."
  ],
  "created_at": "2026-07-31T20:55:00+08:00"
}
