{
  "schema_version": "caesar-loop/v2",
  "evidence_id": "ev_war_zone_gesture_responsive_e43fe45",
  "run_id": "ui_ux_gauntlet_20260731",
  "revision": "e43fe45",
  "valid_through_revision": "e43fe45",
  "gate_id": "gate_war_zone_gesture_responsive",
  "claim": "Five campaign landmarks, raster states and the primary action remain visible and touch-ready at 844x390 and 568x320.",
  "scenario_id": "scenario_war_zone_gesture_icons",
  "execution_id": "war_zone_responsive_e43fe45",
  "evidence_type": "test",
  "artifact_or_command": "WAR_ZONE_SCREEN_TESTS plus dual-size Compatibility captures",
  "case_results": [
    {
      "case_id": "secured_route",
      "result": "pass",
      "assertions": [
        "five route nodes and labels stay clear of detail card at both sizes",
        "normal nodes retain at least 44px height"
      ],
      "artifacts": [
        "project-a/artifacts/scenario-war-zone-exploration/war-zone-844x390.png",
        "project-a/artifacts/scenario-war-zone-exploration/war-zone-568x320.png"
      ]
    },
    {
      "case_id": "frontline_target",
      "result": "pass",
      "assertions": [
        "CTA stays inside bounds and at least 48px high",
        "26px icon budget preserves action text at both sizes"
      ],
      "artifacts": [
        "project-a/artifacts/scenario-war-zone-exploration/war-zone-844x390.png",
        "project-a/artifacts/scenario-war-zone-exploration/war-zone-568x320.png"
      ]
    },
    {
      "case_id": "locked_frontier",
      "result": "pass",
      "assertions": [
        "lock and fortress icons remain inside the safe edge",
        "detail card does not cover unknown landmarks"
      ],
      "artifacts": [
        "project-a/artifacts/scenario-war-zone-exploration/war-zone-568x320.png"
      ]
    }
  ],
  "artifact_manifest": [
    "runtime assertions",
    "844 capture",
    "568 capture",
    "drag signal trace",
    "wheel signal trace",
    "exit code"
  ],
  "environment": {
    "engine": "Godot 4.6.3 Compatibility",
    "platform": "macOS",
    "device": "Apple M4",
    "viewport": "844x390 and 568x320",
    "seed": 20260801,
    "build_mode": "debug"
  },
  "grader": {
    "kind": "runtime",
    "name": "dual-size map geometry assertions",
    "version": "2",
    "independence": "not_applicable"
  },
  "observation": "Both phone captures retain five nodes, raster states and the full CTA label; geometry assertions pass.",
  "inference": "The icon-led route and direct gestures remain responsive at both target phone sizes.",
  "result": "pass",
  "confidence": 0.99,
  "freshness": "current",
  "limitations": [
    "Physical safe-area insets are not present in the focused fixture."
  ],
  "created_at": "2026-08-01T00:40:00Z"
}
