{
  "evidence_id": "ev_faction_choice_model_critic_01bc769",
  "revision": "01bc769",
  "valid_through_revision": "4dee270",
  "gate_id": "gate_faction_choice_visual",
  "claim": "The faction-core choice reads as a consequential duel between two distinct toilet characters rather than two generic signal cards.",
  "scenario_id": "scenario_faction_core_choice_identity",
  "execution_id": "faction_choice_critic_01bc769",
  "evidence_type": "model_critique",
  "artifact_or_command": "independent critic review of baseline, candidate and integrated captures",
  "case_results": [
    {
      "case_id": "candidate_choice",
      "result": "pass",
      "assertions": [
        "identity 8.5, fairness 7.5, density 8.5"
      ],
      "artifacts": [
        "project-a/artifacts/scenario-faction-core-choice/candidate_choice-568x320.png"
      ]
    },
    {
      "case_id": "reduced_motion_choice",
      "result": "pass",
      "assertions": [
        "visual hierarchy persists without animation"
      ],
      "artifacts": [
        "project-a/artifacts/scenario-faction-core-choice/reduced_motion_choice-568x320.png"
      ]
    },
    {
      "case_id": "selected_handoff",
      "result": "pass",
      "assertions": [
        "chosen identity and clean handoff material remain unified"
      ],
      "artifacts": [
        "project-a/artifacts/scenario-faction-core-choice/selected_handoff-568x320.png"
      ]
    }
  ],
  "artifact_manifest": [
    "runtime assertions",
    "candidate choice captures",
    "reduced-motion captures",
    "selected handoff captures",
    "case manifest",
    "exit code"
  ],
  "environment": {
    "engine": "Godot 4.6.3",
    "platform": "rendered capture review",
    "device": "independent Codex critic",
    "viewport": "844x390 and 568x320",
    "seed": 20260731,
    "build_mode": "debug"
  },
  "grader": {
    "kind": "model",
    "name": "faction choice independent critic",
    "version": "third review",
    "independence": "independent",
    "agent_thread_id": "/root/faction_choice_critic"
  },
  "observation": "Scores: identity 8.5, fairness 7.5, touch/readability 7.5, compact fit 8.5, image-led density 8.5, unity 7.5.",
  "inference": "Visual threshold passes narrowly after two rejected candidate rounds.",
  "result": "pass",
  "confidence": 0.9,
  "freshness": "current",
  "limitations": [
    "Assault art retains greater visual weight than the legacy flying render.",
    "Integrated 568 text and navigation have limited comfort margin."
  ],
  "schema_version": "caesar-loop/v2",
  "run_id": "ui_ux_gauntlet_20260731"
}
