{
  "schema_version": "caesar-loop/v2",
  "evidence_id": "ev_legion_baseline_responsive_2e23dd4",
  "run_id": "ui_ux_gauntlet_20260731",
  "revision": "2e23dd4",
  "valid_through_revision": "2e23dd4",
  "gate_id": "gate_legion_responsive",
  "claim": "Formation portraits, six slots and the primary action remain visible and touch-sized at 844x390 and 568x320.",
  "scenario_id": "scenario_legion_formation_identity",
  "execution_id": "legion_baseline_2e23dd4",
  "evidence_type": "runtime_state",
  "artifact_or_command": "dual viewport LegionScreen focused bundle",
  "case_results": [
    {
      "case_id": "single_commander",
      "result": "fail",
      "assertions": [
        "slots fit but occupied character portrait is only a tiny badge"
      ],
      "artifacts": [
        "project-a/artifacts/scenario-legion-formation/baseline/single_commander-568x320.png"
      ]
    },
    {
      "case_id": "slot_selected",
      "result": "fail",
      "assertions": [
        "candidate panel pushes content and becomes text-dense at compact size"
      ],
      "artifacts": [
        "project-a/artifacts/scenario-legion-formation/baseline/slot_selected-568x320.png"
      ]
    },
    {
      "case_id": "full_squad",
      "result": "pass",
      "assertions": [
        "six slots and counterattack remain inside viewport"
      ],
      "artifacts": [
        "project-a/artifacts/scenario-legion-formation/baseline/full_squad-568x320.png"
      ]
    }
  ],
  "artifact_manifest": [
    "runtime assertions",
    "single commander captures",
    "selected slot captures",
    "full squad captures",
    "case manifest",
    "exit code"
  ],
  "environment": {
    "engine": "Godot 4.6.3",
    "platform": "macOS Compatibility",
    "device": "Apple M4",
    "viewport": "844x390 and 568x320",
    "seed": 20260731,
    "build_mode": "debug"
  },
  "grader": {
    "kind": "runtime",
    "name": "dual viewport geometry audit",
    "version": "1",
    "independence": "not_applicable"
  },
  "observation": "Geometry fits, but the compact selected state spends most of its useful height on prose and character identity collapses to initials.",
  "inference": "Responsive baseline fails the readable-portrait and contextual-detail portion.",
  "result": "fail",
  "confidence": 0.96,
  "freshness": "current",
  "limitations": [
    "Static fixture does not measure physical safe areas."
  ],
  "created_at": "2026-07-31T20:35:00+08:00"
}
