{
  "evidence_id": "ev_ui_touch_integration_runtime_c48c224",
  "revision": "c48c224",
  "valid_through_revision": "c48c224",
  "gate_id": "gate_ui_runtime",
  "claim": "Title, factory and war-zone actions use shipping state and navigation without regressions.",
  "scenario_id": "scenario_ui_path_integration",
  "execution_id": "ui_touch_integration_c48c224",
  "evidence_type": "test",
  "artifact_or_command": "godot --headless --path project-a --script res://tools/run_ui_smoke_tests.gd && godot --headless --path project-a --script res://tools/run_mobile_scroll_input_tests.gd && GODOT_WEB_TOUCH_DRAG_ONLY=1 node project-a/tools/run_web_browser_smoke.mjs",
  "case_results": [
    {
      "case_id": "cross_screen_cohesion",
      "result": "pass",
      "assertions": [
        "shared UI smoke passes; touch drag scrolls from an interactive card without accidental activation; desktop wheel remains supported; exported Web canvas responds to real CDP touchStart/touchMove/touchEnd"
      ],
      "artifacts": [
        "project-a/tools/run_mobile_scroll_input_tests.gd",
        "project-a/tools/run_web_browser_smoke.mjs",
        "project-a/artifacts/scenario-mobile-faction-doctrine-deck/manifest.json"
      ]
    }
  ],
  "artifact_manifest": [
    "UI smoke assertions",
    "canonical captures",
    "exit code"
  ],
  "environment": {
    "engine": "Godot 4.6.3",
    "platform": "macOS and Chrome Web Compatibility",
    "device": "Apple M4",
    "viewport": "844x390 and 568x320",
    "seed": 20260731,
    "build_mode": "debug Web export"
  },
  "grader": {
    "kind": "runtime",
    "name": "shared mobile scroll and Web touch integration",
    "version": "1",
    "independence": "not_applicable"
  },
  "observation": "UI SMOKE TESTS PASS, MOBILE_SCROLL_INPUT_TESTS_OK and WEB_TOUCH_DRAG_SMOKE_OK at the current revision.",
  "inference": "Global ScrollContainer touch handling integrates with the shipping Web UI without replacing desktop wheel behavior.",
  "result": "pass",
  "confidence": 0.98,
  "freshness": "stale",
  "limitations": [
    "The legacy full browser smoke later times out at its unrelated local playtest-report coordinate flow; the isolated real-touch route completes before that state."
  ],
  "schema_version": "caesar-loop/v2",
  "run_id": "ui_ux_gauntlet_20260731"
}
