{
  "evidence_id": "ev_doctrine_responsive_83972d3",
  "revision": "83972d3",
  "valid_through_revision": "83972d3",
  "gate_id": "gate_doctrine_deck_responsive",
  "claim": "Both doctrine choices and the activated command card remain visible and touch-sized at 844x390 and 568x320.",
  "scenario_id": "scenario_mobile_faction_doctrine_command_deck",
  "execution_id": "doctrine_responsive_83972d3",
  "evidence_type": "capture",
  "artifact_or_command": "godot --path project-a --script res://tools/capture_faction_doctrine_deck_scenario.gd",
  "case_results": [
    {
      "case_id": "assault_choice",
      "result": "pass",
      "assertions": [
        "two equal 88px command cards fit without clipping at both viewports"
      ],
      "artifacts": [
        "project-a/artifacts/scenario-mobile-faction-doctrine-deck/assault_choice-844x390.png",
        "project-a/artifacts/scenario-mobile-faction-doctrine-deck/assault_choice-568x320.png"
      ]
    },
    {
      "case_id": "armored_choice",
      "result": "pass",
      "assertions": [
        "faction emblem and both actions remain visible at both viewports"
      ],
      "artifacts": [
        "project-a/artifacts/scenario-mobile-faction-doctrine-deck/armored_choice-844x390.png",
        "project-a/artifacts/scenario-mobile-faction-doctrine-deck/armored_choice-568x320.png"
      ]
    },
    {
      "case_id": "doctrine_activated",
      "result": "pass",
      "assertions": [
        "activated emblem, title, effect and non-color status fit at both viewports"
      ],
      "artifacts": [
        "project-a/artifacts/scenario-mobile-faction-doctrine-deck/doctrine_activated-844x390.png",
        "project-a/artifacts/scenario-mobile-faction-doctrine-deck/doctrine_activated-568x320.png"
      ]
    }
  ],
  "artifact_manifest": [
    "runtime assertions",
    "assault captures",
    "armored captures",
    "activated captures",
    "case manifest",
    "exit code"
  ],
  "environment": {
    "engine": "Godot 4.6.3",
    "platform": "macOS Compatibility",
    "device": "Apple M4",
    "viewport": "844x390 and 568x320",
    "seed": 20260731,
    "build_mode": "debug"
  },
  "grader": {
    "kind": "runtime",
    "name": "dual-size doctrine command deck audit",
    "version": "1",
    "independence": "not_applicable"
  },
  "observation": "All three deterministic states render without clipping; choice actions retain 88 logical pixel targets at 844x390 and 568x320.",
  "inference": "The doctrine command deck meets both target mobile landscape constraints.",
  "result": "pass",
  "confidence": 0.98,
  "freshness": "stale",
  "limitations": [
    "Browser safe-area behavior is covered by the shared Web smoke rather than these captures."
  ],
  "schema_version": "caesar-loop/v2",
  "run_id": "ui_ux_gauntlet_20260731"
}
